{
  "id": "6830b9d4c7e21f5a8d3e64b2",
  "version": 1,
  "created": "2026-04-26T14:00:00+00:00",
  "updated": "2026-04-26T14:00:00+00:00",
  "status": "Submitted",
  "organisation": {
    "id": "923fa611-571c-4948-ab7d-fbb75e75ed65",
    "registrationType": "DirectProducer",
    "name": "Org Name",
    "complianceSchemeName": null,
    "schemeOperatorName": null,
    "referenceNumber": "123456",
    "address": {
      "addressLine1": "Test Name Ltd",
      "addressLine2": "123 Street",
      "town": "Town",
      "county": "County",
      "postcode": "UK1",
      "country": "UK"
    },
    "businessCountry": "GB-ENG",
    "regulator": "Regulator",
    "regulatorEmail": "regulator@email.com"
  },
  "obligationYear": 2026,
  "obligations": [
    {
      "material": "Plastic",
      "recyclingTarget": 0.75,
      "tonnages": {
        "material": 100,
        "awaitingAcceptance": 10,
        "accepted": 2,
        "outstanding": 20,
        "obligated": 5
      },
      "status": "NoDataYet"
    }
  ],
  "obligationStatus": "NotMet",
  "submitterName": "Submitter Name",
  "isRegulation43Compliant": true,
  "obligationCoveragePercentage": 0,
  "audit": [
    {
      "user": {
        "id": "e72be574-8b5b-4836-af47-dd7e0c0d1d87",
        "email": "submitter@email.com",
        "name": "Submitter Name",
        "locale": "en"
      },
      "timestamp": "2026-04-26T14:00:00+00:00",
      "action": "Submitted"
    }
  ]
}