{
  "id": "6830b14f9d2a7c61f4e8b935",
  "version": 1,
  "created": "DateTimeOffset_1",
  "updated": "DateTimeOffset_1",
  "status": "Accepted",
  "organisation": {
    "id": "Guid_1",
    "registrationType": "DirectProducer",
    "name": "Org Name",
    "complianceSchemeName": null,
    "schemeOperatorName": null,
    "referenceNumber": "123456",
    "address": {
      "addressLine1": "Test Name Ltd",
      "addressLine2": "123 Street",
      "town": "Town",
      "county": "County",
      "postcode": "UK1",
      "country": "UK"
    },
    "businessCountry": "GB-ENG",
    "regulator": "Regulator",
    "regulatorEmail": "regulator@email.com"
  },
  "obligationYear": 2026,
  "obligations": [
    {
      "material": "Plastic",
      "recyclingTarget": 0.75,
      "tonnages": {
        "material": 100,
        "awaitingAcceptance": 10,
        "accepted": 2,
        "outstanding": 20,
        "obligated": 5
      },
      "status": "NoDataYet"
    }
  ],
  "obligationStatus": "NotMet",
  "submitterName": "Submitter Name",
  "isRegulation43Compliant": true,
  "obligationCoveragePercentage": 40,
  "audit": [
    {
      "user": {
        "id": "Guid_2",
        "email": "submitter@email.com",
        "name": "Submitter Name",
        "locale": "en"
      },
      "timestamp": "DateTimeOffset_1",
      "action": "Submitted"
    },
    {
      "user": {
        "id": "Guid_3",
        "email": "regulator@email.com",
        "name": "Regulator Name",
        "locale": "en"
      },
      "timestamp": "DateTimeOffset_1",
      "action": "Accepted"
    }
  ]
}