{
  "id": "{Scrubbed}",
  "version": 3,
  "created": "{Scrubbed}",
  "updated": "{Scrubbed}",
  "status": "Cancelled",
  "organisation": {
    "id": "Guid_1",
    "registrationType": "DirectProducer",
    "name": "Org Name",
    "complianceSchemeName": null,
    "schemeOperatorName": null,
    "referenceNumber": "123456",
    "address": {
      "addressLine1": "Test Name Ltd",
      "addressLine2": "123 Street",
      "town": "Town",
      "county": "County",
      "postcode": "UK1",
      "country": "UK"
    },
    "businessCountry": "GB-ENG",
    "regulator": "Regulator",
    "regulatorEmail": "regulator@email.com"
  },
  "obligationYear": 2026,
  "obligations": [
    {
      "material": "Plastic",
      "recyclingTarget": 0.75,
      "tonnages": {
        "material": 100,
        "awaitingAcceptance": 10,
        "accepted": 2,
        "outstanding": 20,
        "obligated": 5
      },
      "status": "NoDataYet"
    }
  ],
  "obligationStatus": "NotMet",
  "submitterName": "Submitter Name",
  "isRegulation43Compliant": true,
  "obligationCoveragePercentage": 0,
  "audit": [
    {
      "user": {
        "id": "Guid_2",
        "email": "submitter@email.com",
        "name": "Submitter Name",
        "locale": "en"
      },
      "timestamp": "{Scrubbed}",
      "action": "Submitted"
    },
    {
      "user": {
        "id": "Guid_3",
        "email": "regulator@email.com",
        "name": "Regulator Name",
        "locale": "en"
      },
      "timestamp": "{Scrubbed}",
      "action": "Accepted"
    },
    {
      "reason": "Producer requested to cancel",
      "user": {
        "id": "Guid_4",
        "email": "approved-person@email.com",
        "name": "Approved Person Name",
        "locale": "en"
      },
      "timestamp": "{Scrubbed}",
      "action": "Cancelled"
    }
  ]
}